{
  "$schema": "https://json-schema.org/draft/2020-12/schema",
  "$id": "https://github.com/kiencuongnguyen88/diamond-os/schemas/sun-graph/approved-public-subset.schema.json",
  "title": "PG-U04 Approved Public Subset",
  "type": "object",
  "required": [
    "contract_id",
    "unit_id",
    "state",
    "canon",
    "human_selection",
    "source_refs",
    "git_native",
    "public_boundary",
    "claim_boundary"
  ],
  "properties": {
    "contract_id": {
      "const": "PG_U04_APPROVED_PUBLIC_SUBSET_v0_1"
    },
    "unit_id": {
      "const": "PG-U04"
    },
    "state": {
      "const": "GIT_CANDIDATE"
    },
    "canon": {
      "const": false
    },
    "human_selection": {
      "type": "object"
    },
    "source_refs": {
      "type": "array",
      "minItems": 3,
      "maxItems": 3
    },
    "source_db": {
      "type": "object"
    },
    "git_native": {
      "type": "object"
    },
    "public_boundary": {
      "type": "object"
    },
    "claim_boundary": {
      "type": "object"
    }
  },
  "additionalProperties": false
}
